{
  "schemaVersion": 1,
  "producedAt": "2026-08-21T00:00:00Z",
  "producer": "present-schema-registry",
  "schemas": [
    {
      "id": "acceptance-manifest-v1",
      "version": 1,
      "schemaFile": "acceptance-manifest-v1.json",
      "owner": "broker",
      "artifactKind": "acceptance-manifest",
      "producer": "present-lease-broker",
      "validationPoints": [
        "broker-artifact-write",
        "broker-artifact-audit"
      ],
      "lifecycle": "active",
      "compatibility": "initial",
      "introducedAt": "2026-08-18"
    },
    {
      "id": "admission-report-v1",
      "version": 1,
      "schemaFile": "admission-report-v1.json",
      "owner": "broker",
      "artifactKind": "admission-report",
      "producer": "present-lease-broker",
      "validationPoints": [
        "broker-schema-boundary",
        "broker-response"
      ],
      "lifecycle": "active",
      "compatibility": "initial",
      "introducedAt": "2026-08-18"
    },
    {
      "id": "adversarial-result-v1",
      "version": 1,
      "schemaFile": "adversarial-result-v1.json",
      "owner": "worker",
      "artifactKind": "adversarial",
      "artifactStages": [
        "adversarial"
      ],
      "producer": "present-worker",
      "validationPoints": [
        "worker-write"
      ],
      "lifecycle": "active",
      "compatibility": "initial",
      "introducedAt": "2026-08-18"
    },
    {
      "id": "agent-tool-contract-registry-v1",
      "version": 1,
      "schemaFile": "agent-tool-contract-registry-v1.json",
      "owner": "worker",
      "artifactKind": "agent-tool-contract-registry",
      "producer": "present-worker",
      "validationPoints": [
        "worker-emit"
      ],
      "lifecycle": "active",
      "compatibility": "initial",
      "introducedAt": "2026-08-18"
    },
    {
      "id": "agent-session-status-v1",
      "version": 1,
      "schemaFile": "agent-session-status-v1.json",
      "owner": "schema-authority",
      "artifactKind": "agent-session-status",
      "producer": "steel-mission-bench",
      "validationPoints": [
        "bench-feed-write",
        "progress-feed-read",
        "store-status-write",
        "runner-status-transport"
      ],
      "lifecycle": "active",
      "compatibility": "initial",
      "introducedAt": "2026-08-21"
    },
    {
      "id": "artifact-integrity-ledger-v1",
      "version": 1,
      "schemaFile": "artifact-integrity-ledger-v1.json",
      "owner": "broker",
      "artifactKind": "artifact-integrity-ledger",
      "producer": "present-lease-broker",
      "validationPoints": [
        "broker-artifact-write",
        "broker-response"
      ],
      "lifecycle": "active",
      "compatibility": "initial",
      "introducedAt": "2026-08-18"
    },
    {
      "id": "artifact-provenance-chain-v1",
      "version": 1,
      "schemaFile": "artifact-provenance-chain-v1.json",
      "owner": "broker",
      "artifactKind": "artifact-provenance",
      "producer": "present-lease-broker",
      "validationPoints": [
        "broker-artifact-write",
        "broker-artifact-audit"
      ],
      "lifecycle": "active",
      "compatibility": "initial",
      "introducedAt": "2026-08-18"
    },
    {
      "id": "artifact-transfer-manifest-v1",
      "version": 1,
      "schemaFile": "artifact-transfer-manifest-v1.json",
      "owner": "broker",
      "artifactKind": "artifact-transfer-manifest",
      "producer": "present-lease-broker",
      "validationPoints": [
        "broker-response"
      ],
      "lifecycle": "active",
      "compatibility": "initial",
      "introducedAt": "2026-08-18"
    },
    {
      "id": "broker-distributed-artifacts-v1",
      "version": 1,
      "schemaFile": "broker-distributed-artifacts-v1.json",
      "owner": "broker",
      "artifactKind": "broker-distributed-artifacts",
      "producer": "present-lease-broker",
      "validationPoints": [
        "broker-response"
      ],
      "lifecycle": "active",
      "compatibility": "initial",
      "introducedAt": "2026-08-18"
    },
    {
      "id": "broker-distributed-state-v1",
      "version": 1,
      "schemaFile": "broker-distributed-state-v1.json",
      "owner": "broker",
      "artifactKind": "broker-distributed-state",
      "producer": "present-lease-broker",
      "validationPoints": [
        "broker-state-write"
      ],
      "lifecycle": "active",
      "compatibility": "initial",
      "introducedAt": "2026-08-18"
    },
    {
      "id": "broker-event-v1",
      "version": 1,
      "schemaFile": "broker-event-v1.json",
      "owner": "broker",
      "artifactKind": "broker-event",
      "producer": "present-lease-broker",
      "validationPoints": [
        "broker-state-write"
      ],
      "lifecycle": "active",
      "compatibility": "initial",
      "introducedAt": "2026-08-18"
    },
    {
      "id": "broker-event-type-registry-v1",
      "version": 1,
      "schemaFile": "broker-event-type-registry-v1.json",
      "owner": "broker",
      "artifactKind": "broker-event-type-registry",
      "producer": "present-lease-broker",
      "validationPoints": [
        "broker-state-write"
      ],
      "lifecycle": "active",
      "compatibility": "initial",
      "introducedAt": "2026-08-18"
    },
    {
      "id": "broker-provision-discovery-request-v1",
      "version": 1,
      "schemaFile": "broker-provision-discovery-request-v1.json",
      "owner": "broker",
      "artifactKind": "broker-provision-discovery-request",
      "producer": "present-lease-broker",
      "validationPoints": [
        "broker-provision-discovery-request"
      ],
      "lifecycle": "active",
      "compatibility": "initial",
      "introducedAt": "2026-08-18"
    },
    {
      "id": "broker-provision-discovery-response-v1",
      "version": 1,
      "schemaFile": "broker-provision-discovery-response-v1.json",
      "owner": "broker",
      "artifactKind": "broker-provision-discovery-response",
      "producer": "present-lease-broker",
      "validationPoints": [
        "broker-provision-discovery-response"
      ],
      "lifecycle": "active",
      "compatibility": "initial",
      "introducedAt": "2026-08-18"
    },
    {
      "id": "broker-provision-request-v1",
      "version": 1,
      "schemaFile": "broker-provision-request-v1.json",
      "owner": "broker",
      "artifactKind": "broker-provision-request",
      "producer": "present-lease-broker",
      "validationPoints": [
        "broker-provision-request"
      ],
      "lifecycle": "active",
      "compatibility": "initial",
      "introducedAt": "2026-08-18"
    },
    {
      "id": "broker-provision-reservation-request-v1",
      "version": 1,
      "schemaFile": "broker-provision-reservation-request-v1.json",
      "owner": "broker",
      "artifactKind": "broker-provision-reservation-request",
      "producer": "present-lease-broker",
      "validationPoints": [
        "broker-provision-reservation-request"
      ],
      "lifecycle": "active",
      "compatibility": "initial",
      "introducedAt": "2026-08-18"
    },
    {
      "id": "broker-provision-reservation-response-v1",
      "version": 1,
      "schemaFile": "broker-provision-reservation-response-v1.json",
      "owner": "broker",
      "artifactKind": "broker-provision-reservation-response",
      "producer": "present-lease-broker",
      "validationPoints": [
        "broker-provision-reservation-response"
      ],
      "lifecycle": "active",
      "compatibility": "initial",
      "introducedAt": "2026-08-18"
    },
    {
      "id": "broker-provision-response-v1",
      "version": 1,
      "schemaFile": "broker-provision-response-v1.json",
      "owner": "broker",
      "artifactKind": "broker-provision-response",
      "producer": "present-lease-broker",
      "validationPoints": [
        "broker-provision-response"
      ],
      "lifecycle": "active",
      "compatibility": "initial",
      "introducedAt": "2026-08-18"
    },
    {
      "id": "broker-response-error-v1",
      "version": 1,
      "schemaFile": "broker-response-error-v1.json",
      "owner": "broker",
      "artifactKind": "broker-response-error",
      "producer": "present-lease-broker",
      "validationPoints": [
        "broker-emit"
      ],
      "lifecycle": "active",
      "compatibility": "initial",
      "introducedAt": "2026-08-18"
    },
    {
      "id": "broker-lock-request-v1",
      "version": 1,
      "schemaFile": "broker-lock-request-v1.json",
      "owner": "broker",
      "artifactKind": "broker-lock-request",
      "producer": "present-lease-broker",
      "validationPoints": [
        "broker-lock-request"
      ],
      "lifecycle": "active",
      "compatibility": "initial",
      "introducedAt": "2026-08-18"
    },
    {
      "id": "broker-lock-response-v1",
      "version": 1,
      "schemaFile": "broker-lock-response-v1.json",
      "owner": "broker",
      "artifactKind": "broker-lock-response",
      "producer": "present-lease-broker",
      "validationPoints": [
        "broker-lock-response"
      ],
      "lifecycle": "active",
      "compatibility": "initial",
      "introducedAt": "2026-08-18"
    },
    {
      "id": "broker-response-gc-v1",
      "version": 1,
      "schemaFile": "broker-response-gc-v1.json",
      "owner": "broker",
      "artifactKind": "broker-response-gc",
      "producer": "present-lease-broker",
      "validationPoints": [
        "broker-emit"
      ],
      "lifecycle": "active",
      "compatibility": "initial",
      "introducedAt": "2026-08-18"
    },
    {
      "id": "broker-response-compact-v1",
      "version": 1,
      "schemaFile": "broker-response-compact-v1.json",
      "owner": "broker",
      "artifactKind": "broker-response-compact",
      "producer": "present-lease-broker",
      "validationPoints": [
        "broker-emit"
      ],
      "lifecycle": "active",
      "compatibility": "initial",
      "introducedAt": "2026-08-18"
    },
    {
      "id": "broker-response-lease-v1",